name,post,address,lat,lng,monday,tuesday,wednesday,thursday,friday,saturday,sunday,tel,fax
ナチュラルローソンクオール薬局東品川4丁目店,140-0002,東京都品川区東品川4-5-22,35.6090525,139.7466711,,,,,,,,03-6718-4089,0120-143-901
ザグザグ薬局大元店,700-0924,岡山県岡山市北区大元1-13-18,34.6469908,133.9029442,,,,,,,,086-805-1305,086-805-1305
調剤薬局ツルハドラッグ仙台五橋店,984-0022,宮城県仙台市若林区五橋3-2-1-1F,38.2537047,140.881991,,,,,,,,022-212-3268,022-212-368
鳥取中央薬局,680-0833,鳥取県鳥取市末広温泉町362,35.495194,134.2303791,,,,,,,,0857-24-0154,0857-24-0155
ココカラファイン薬局成瀬店,194-0044,東京都町田市成瀬4-1-3,35.5436655,139.4746713,,,,,,,,042-732-6714,042-732-6715
ドラッグストアモリ上津店,830-0056,福岡県久留米市本山1-3-15,33.2870734,130.519544,,,,,,,,0942-21-6066,0942-21-6066
ウエルシア千葉高津戸店,267-0053,千葉県千葉市緑区高津戸町84-12,35.5326554,140.2608201,,,,,,,,043-295-1593,043-295-1594
(有)フジヒラ薬局,296-0001,千葉県鴨川市横渚970-1,35.1095061,140.1035529,,,,,,,,047-092-1951,047-092-1941
クスリのアオキ新富店,939-1343,富山県砺波市新富町5-47,36.6391128,136.9485563,,,,,,,,0763-33-1012,0120-505-362
アイン薬局日本医大北総店,270-1613,千葉県印西市鎌苅1715,35.7808775,140.1983901,,,,,,,,0476-85-6966,0476-85-6967
稲垣薬局サンロード店,180-0004,東京都武蔵野市吉祥寺本町1-11-27,35.7055036,139.5806275,,,,,,,,0422-23-8083,0422-23-8084
日本調剤小岩薬局,133-0051,東京都江戸川区北小岩6-15-5　第2石井ﾋﾞﾙ1Ｆ,35.7423369,139.8843409,,,,,,,,03-5622-0601,03-5622-0603
薬局トモズ野沢店,154-0003,東京都世田谷区野沢2-5-20　ﾊﾟｽﾄﾗﾙ野沢壱番館1Ｆ,35.6324218,139.671159,,,,,,,,03-5431-5461,03-5431-5462
日生薬局広尾店*,107-0062,東京都港区南青山7-14-7　西川ﾋﾞﾙ1F,35.6565858,139.7178556,,,,,,,,03-5469-8851,03-5469-8852
ドラッグセイムス浦和駅東口店,330-0055,埼玉県さいたま市浦和区東高砂町1-9-1,35.8587124,139.6576663,,,,,,,,048-813-1670,048-813-1671
ツルハドラッグ西町北店,063-0061,北海道札幌市西区西町北10-1-6,43.0813861,141.2860953,,,,,,,,011-688-5165,011-688-5165
とおやま薬局アミュプラザ小倉店,802-0001,福岡県北九州市小倉北区浅野1-1-1　ｱﾐｭﾌﾟﾗｻﾞ小倉地下1F,33.8865122,130.8823211,,,,,,,,093-967-2552,093-967-2883
ウエルシア狭山東三ツ木店,350-1302,埼玉県狭山市東三ツ木197-1,35.8704678,139.4356723,,,,,,,,04-2969-6697,04-2969-6678
スギ薬局北入曽店,350-1315,埼玉県狭山市大字北入曽720-1　ﾔｵｺｰ北入曽店内,35.844969,139.4299213,,,,,,,,080-7037-0478,0800-919-7205
ウエルシア板橋赤塚店,175-0092,東京都板橋区赤塚6-1-26,35.7733876,139.6462424,,,,,,,,03-5904-7811,03-5904-7811
薬マツモトキヨシ北千住駅前店,120-0034,東京都足立区千住2-59,35.7501762,139.8038258,,,,,,,,03-3881-6854,03-3881-6854
イオン薬局桂川店*,601-8211,京都府京都市南区久世高田町376-1,34.9615212,135.7085288,,,,,,,,075-925-3132,075-925-3133
フラワー薬局野方店,165-0027,東京都中野区野方5-3-1　野方WIZ103,35.7183387,139.6531414,,,,,,,,03-5356-9044,03-5356-9045
やまと調剤薬局,165-0034,東京都中野区大和町1-64-1　ﾋﾞｱﾝｶｰﾗ高円寺,35.709822,139.6499718,,,,,,,,03-3337-3380,03-3337-3380
イオックス薬局高円寺店,165-0034,東京都中野区大和町1-31-5-1F,35.7096097,139.6517355,,,,,,,,03-5364-9120,03-5364-9121
イオン薬局イオンスタイル広島府中,735-0021,広島県安芸郡府中町大須2-1-1,34.3923838,132.4999356,,,,,,,,082-561-0230,082-561-0231
スギ薬局吉祥寺店,180-0004,東京都武蔵野市吉祥寺本町1-8-3　三松ﾋﾞﾙ,35.7043122,139.5794762,,,,,,,,080-4832-5373,0422-27-6642
けやき薬局,180-0004,東京都武蔵野市吉祥寺本町1-4-15　ﾎﾜｲﾄﾊｳｽﾋﾞﾙ1F,35.7032834,139.578465,,,,,,,,0422-21-6041,0422-21-3200
サンキュードラッグ一枝薬局,804-0021,福岡県北九州市戸畑区一枝2-3-35,33.8855892,130.840958,,,,,,,,093-873-2139,093-873-2140
イオン薬局木更津店,292-0835,千葉県木更津市築地1-4,35.3648754,139.9097512,,,,,,,,0438-38-8609,0438-38-8619
ココカラファイン薬局真駒内店,005-0014,北海道札幌市南区真駒内幸町2-1-12　ミューｸﾘｽﾀﾙ地下1F,42.9904622,141.3545625,,,,,,,,011-582-2783,011-582-4867
イオン薬局木更津店,292-0835,千葉県木更津市築地1-4,35.3648754,139.9097512,,,,,,,,0438-38-8609,0438-38-8619
ウエルシア葛飾東立石店,124-0013,東京都葛飾区東立石1-12-9,35.7300562,139.8479667,,,,,,,,03-5654-2128,03-5654-2129
薬マツモトキヨシmatsukiyoLAB柏駅西口店,277-0842,千葉県柏市末広町4-1　神崎ﾋﾞﾙ1F,35.8629069,139.9700416,,,,,,,,04-7140-1822,04-7140-1822
杏林堂薬局東陽町店,135-0016,東京都江東区東陽2-4-26,35.6685974,139.816667,,,,,,,,03-5606-4351,03-5606-4352
ウエルシア小野天神店,675-1316,兵庫県小野市天神町815-1,34.8451561,134.9452586,,,,,,,,0794-64-6032,0794-64-6033
クリエイトS・D柿の木台店,227-0048,神奈川県横浜市青葉区柿の木台4-7　ﾎﾞﾅｰﾙもえぎ野,35.5493715,139.5257509,,,,,,,,045-979-0650,045-979-0651
調剤薬局日本メディカルシステム北戸田店,335-0021,埼玉県戸田市新曽1991　ﾘﾉﾘｰｿﾞ103,35.8281085,139.6618493,,,,,,,,048-242-5706,048-242-5707
本吉調剤薬局,988-0381,宮城県気仙沼市本吉町津谷新明戸326-1,38.787505,141.501414,,,,,,,,0226-42-1088,0226-42-1089
日本調剤ザガーデン薬局,211-0063,神奈川県川崎市中原区小杉町2-228-1　ﾊﾟｰｸｼﾃｨ武蔵小杉ｻﾞｶﾞｰﾃﾞﾝﾀﾜｰｽﾞW1,35.5777384,139.6550573,,,,,,,,044-543-9002,044-543-9003
ウエルシア柏南増尾店,277-0054,千葉県柏市南増尾8-3-31,35.8116461,139.9585732,,,,,,,,04-7160-7620,04-7160-7620
アイリス薬局松山平和通店,790-0807,愛媛県松山市平和通1-5-23,33.8478617,132.7739402,,,,,,,,089-992-9251,089-992-9252
クローブ薬局,142-0041,東京都品川区戸越1-7-1　東急戸越ﾋﾞﾙ1F,35.6166981,139.7176411,,,,,,,,03-5751-7388,03-5751-7255
調剤薬局日本メディカルシステム伊勢原店,259-1132,神奈川県伊勢原市桜台1-2-34　伊勢原大神宮ﾋﾞﾙ1F,35.3950661,139.3133644,,,,,,,,0463-74-6395,0463-74-6396
mac南国調剤薬局,783-0006,高知県南国市篠原170-1,33.5695536,133.6350571,,,,,,,,088-863-7720,088-863-7721
薬マツモトキヨシ下井草店,167-0022,東京都杉並区下井草3-38-18　ﾚｳﾞｫ1階,35.7232417,139.6241981,,,,,,,,03-3394-6515,03-3394-6515
イオンフードスタイルソコラ塚口店薬局,661-0012,兵庫県尼崎市南塚口町2-1-3　1階,34.7521186,135.4153905,,,,,,,,06-6427-4466,0120-624-702
おばなわ薬局,167-0023,東京都杉並区上井草3-31-15　石泉ﾋﾞﾙ102,35.7248794,139.6032791,,,,,,,,03-3394-1701,03-3394-1701
大手前薬局谷町店*,540-0025,大阪府大阪市中央区徳井町1-1-8,34.6842055,135.5160439,,,,,,,,06-6943-9433,06-6941-8876
ウエルシア千葉土気店,267-0067,千葉県千葉市緑区あすみが丘東2-19-3,35.5254962,140.2802402,,,,,,,,043-205-7750,043-205-7751
ウエルシア流山美原店,270-0103,千葉県流山市美原3-2-1,35.9025016,139.9014576,,,,,,,,04-7153-6631,04-7153-6632
えがおde薬局,542-0073,大阪府大阪市中央区日本橋1-16-19　ｼｬﾄｰｱﾙｰﾌ1F,34.6667115,135.5072412,,,,,,,,06-6556-9192,06-6556-9193
両国調剤薬局,130-0021,東京都墨田区緑1-14-4,35.6944469,139.7991715,,,,,,,,03-5600-5068,03-5600-5068
フレンズ調剤薬局,194-0046,東京都町田市西成瀬3-19-22,35.5514645,139.4720312,,,,,,,,042-724-1306,042-724-1306
スギドラッグ千里山店,565-0843,大阪府吹田市千里山松が丘26-12　ﾒｿﾞﾝﾘﾗ千里山1Ｆ,34.7792332,135.5080305,,,,,,,,06-6310-9777,06-6387-8817
スギドラッグ佐井寺店,565-0836,大阪府吹田市佐井寺3丁目20番32号,34.7855645,135.5148199,,,,,,,,06-4861-3051,06-6330-5025
ウエルシア薬局大和中央林間店,242-0007,神奈川県大和市中央林間8-25-2,35.5087018,139.4491036,,,,,,,,046-278-2161,046-278-2162
ウエルシア流山おおたかの森店,270-0128,千葉県流山市おおたかの森西4-9,35.874307,139.9196344,,,,,,,,04-7178-2889,04-7178-2888
イオン薬局那覇店,901-0155,沖縄県那覇市金城5-10-2　ｲｵﾝ那覇店1F,26.1969565,127.6657676,,,,,,,,098-891-8211,098-891-8212
𠮷川美南中央薬局,342-0038,埼玉県𠮷川市美南2-23-1　ﾒﾃﾞｨｶﾙセンター𠮷川美南1F,35.8670377,139.8565839,,,,,,,,048-982-7733,048-982-7734
サンドラッグフォレストモール木津川調剤薬局,619-0215,京都府木津川市梅美台1-1-1,34.7149337,135.8357335,,,,,,,,0774-71-8008,0774-71-8009
横浜西口薬局KS店,220-0004,神奈川県横浜市西区北幸1-11-5　相鉄KSビル4F,35.4673844,139.6178367,,,,,,,,045-290-0816,045-290-0817
トモズ汐留シティセンター店,105-0021,東京都港区東新橋1-5-2　汐留ｼﾃｨセンターB2F,35.6654972,139.7608806,,,,,,,,03-6215-9933,03-6215-9934
ドラッグスギヤマ大治店,490-1141,愛知県海部郡大治町馬島字山西39,35.1730249,136.8181313,,,,,,,,052-445-1200,052-445-1241
あけぼの薬局,162-0065,東京都新宿区住吉町2-18　ｳｨﾝ四谷104,35.6920778,139.7216564,,,,,,,,03-3358-6388,03-3341-8840
中西薬局,169-0075,東京都新宿区高田馬場3-2-5,35.7140083,139.7032339,,,,,,,,03-3371-6790,03-5386-4156
イオン薬局久里浜店,239-0831,神奈川県横須賀市久里浜5-13-1,35.2290339,139.7040612,,,,,,,,046-838-5240,046-838-5241
イオン薬局南砂店,136-0076,東京都江東区南砂6-7-15　ｲｵﾝ南砂店1階,35.6718431,139.8350845,,,,,,,,03-5677-3514,03-5677-3514
イオン薬局水戸内原店,319-0317,茨城県水戸市内原2-1,36.3748023,140.3595087,,,,,,,,029-259-9167,029-259-9165
ウエルシア長泉納米里店,411-0933,静岡県駿東郡長泉町納米里73-15,35.1489443,138.8986039,,,,,,,,055-980-5717,055-980-5727
薬マツモトキヨシ銀座5th店,104-0061,東京都中央区銀座5-5-1,35.6717509,139.7639102,,,,,,,,03-3574-7870,03-3574-7870
ドラッグストアマツモトキヨシ牧の原モア店*,270-1331,千葉県印西市牧の原1-1-3,35.8053539,140.1673698,,,,,,,,0476-45-7150,0476-45-7150
タマナ薬局,178-0064,東京都練馬区南大泉5-31-14,35.7491831,139.5698235,,,,,,,,03-6904-4941,03-6904-4942
フルヤマ薬局東千葉店,260-0041,千葉県千葉市中央区東千葉1-1-16,35.6199653,140.1248463,,,,,,,,043-287-6734,043-253-0030
スギ薬局松阪中央店,515-0015,三重県松阪市宮町51-3,34.5780954,136.5450763,,,,,,,,080-9467-5973,0598-50-1373
カワチ薬局塩尻店,399-0746,長野県塩尻市大門並木町11-10,36.1188961,137.9535977,,,,,,,,026-351-0510,0263-51-0511
薬局くすりの福太郎西船橋店,273-0031,千葉県船橋市西船4-22-1,35.7086766,139.9585343,,,,,,,,047-437-8897,047-437-8897
トモズEQUIA曳舟店,131-0032,東京都墨田区東向島2-26-6　EQUIA曳舟店1F,35.7181636,139.8165835,,,,,,,,03-6661-8655,03-5655-3511
ひきふね薬局,131-0032,東京都墨田区東向島2-13-15,35.7172239,139.8160852,,,,,,,,03-3618-3031,03-3618-3401
日本調剤瀬戸薬局,489-0065,愛知県瀬戸市西追分町160番地1階,35.2259718,137.0830702,,,,,,,,0561-89-6393,0561-89-6515
日本調剤聖マリア病院前薬局,830-0047,福岡県久留米市津福本町417-1,33.3042668,130.5085407,,,,,,,,0942-27-8446,0942-27-8486
日本調剤山手通薬局,466-0815,愛知県名古屋市昭和区山手通3丁目8-1　1F,35.1443581,136.9644319,,,,,,,,052-680-9935,052-680-9936
いずみ薬局岩見沢店,068-0030,北海道岩見沢市十条西4丁目2-1,43.1961297,141.7692137,,,,,,,,0126-23-7897,0126-35-4348
プラス薬局,164-0013,東京都中野区弥生町1-54-11,35.691313,139.6775187,,,,,,,,03-3373-8335,03-3373-8335
金山町薬局,332-0014,埼玉県川口市金山町12-1　ｻｳｽｹﾞｰﾄﾀﾜｰ川口102,35.7966072,139.7214655,,,,,,,,048-280-6739,048-280-6749
湘南薬局,244-0801,神奈川県横浜市戸塚区品濃町548-2　NSﾋﾞﾙ1F,35.431888,139.5580373,,,,,,,,045-822-4663,045-822-9398
クスリのナカヤマ薬局喜多見駅前店,157-0067,東京都世田谷区喜多見8-8-12　ｺｰﾎﾟ真木1F,35.6362619,139.5882648,,,,,,,,03-5727-1031,03-5727-1031
スギ薬局北入曽店,350-1315,埼玉県狭山市大字北入曽720-1　ﾔｵｺｰ北入曽店内,35.844969,139.4299213,,,,,,,,080-7037-0478,04-2950-5851
絹の台ふれあい薬局,300-2436,茨城県つくばみらい市絹の台２丁目4−１３,35.9787203,139.9805869,,,,,,,,0297-25-3636,0297-25-3656
クオール薬局平田店,272-0031,千葉県市川市平田4-3-6,35.7191303,139.919585,,,,,,,,047-393-3739,047-393-3756
カワチ薬品真岡西店,321-4337,栃木県真岡市上高間木3-2-1,36.4400431,139.9872462,,,,,,,,0285-80-7980,0285-80-7981
トモズ反町店,221-0825,神奈川県横浜市神奈川区反町3-17-2,35.4747601,139.625983,,,,,,,,045-628-9405,045-628-9406
緑園調剤薬局,245-0002,神奈川県横浜市泉区緑園2-1-6,35.4390419,139.5210372,,,,,,,,045-813-3601,045-813-3601
日本調剤安佐北薬局,731-0223,広島県広島市安佐北区可部南5-13-14,34.5055052,132.5150056,,,,,,,,082-819-3190,082-819-3191
日本調剤天使病院前薬局,065-0012,北海道札幌市東区北十二条東4-1-11,43.0777976,141.3661992,,,,,,,,011-752-8700,011-752-8880
日本調剤木町通薬局,980-0801,宮城県仙台市青葉区木町通1-8-18,38.2706674,140.8620536,,,,,,,,022-217-6672,022-217-6675
トモズ武蔵新城店,211-0044,神奈川県川崎市中原区新城1-3-1,35.5854475,139.6309409,,,,,,,,044-799-7944,044-381-7727
ウエルシア熊谷佐谷田店,360-0023,埼玉県熊谷市佐谷田2402-1,36.1267201,139.4171372,,,,,,,,048-525-8261,048-525-8265
かるがも調剤薬局,120-0003,東京都足立区東和2-10-3,35.7688471,139.8433795,,,,,,,,03-3629-0494,03-3629-1914
ハックドラッグあざみ野店,225-0011,神奈川県横浜市青葉区あざみ野1-11-2,35.5684325,139.5519977,,,,,,,,045-909-1427,045-909-1455
そうごう薬局浦和店,330-0061,埼玉県さいたま市浦和区常盤9-4-4,35.8665794,139.6462804,,,,,,,,048-823-5731,048-823-5732
クラフト薬局南浦和店,336-0017,埼玉県さいたま市南区南浦和2-31-19,35.8495909,139.6722555,,,,,,,,048-881-1001,048-881-1027
薬局アポック入間店,358-0003,埼玉県入間市豊岡1-5-23　ｵﾃﾞｯｾｲﾋﾞﾙ1F,35.8366072,139.3877932,,,,,,,,04-2960-1620,04-2960-1621
ツルハドラッグ秋田川尻店,010-0943,秋田県秋田市川尻御休町5-27,39.713303,140.095758,,,,,,,,018-896-4268,018-896-4268
うさぎ薬局新松戸店,270-0034,千葉県松戸市新松戸1-410-2,35.8279792,139.920617,,,,,,,,047-374-6651,047-374-6652
ドラッグスギヤマ三ノ輪店*,440-0837,愛知県豊橋市三ノ輪町本興寺15-2,34.7474224,137.4105217,,,,,,,,0532-65-8761,0532-65-8762
薬マツモトキヨシ天王洲アイル店,140-0002,東京都品川区東品川2-3-12　ｼｰﾌｫｰﾄｽｸｴｱ1F,35.6243988,139.7508765,,,,,,,,03-3474-1038,03-3474-1038
スギ薬局岩成台店,487-0033,愛知県春日井市岩成台5-2-7,35.2767928,137.0413357,,,,,,,,080-7576-1005,0568-95-0345
アイン薬局芝大門店,105-0012,東京都港区芝大門1-1-33　三洋ﾋﾞﾙ1F,35.660038,139.7527711,,,,,,,,03-6452-8952,03-6452-8953
そうごう薬局成田東店,287-0225,千葉県成田市吉岡1342-58,35.8125916,140.3942642,,,,,,,,0476-49-3711,0476-73-7682
ココカラファイン千歳船橋調剤店,156-0055,東京都世田谷区船橋1-1-7,35.6478026,139.6239217,,,,,,,,03-6913-2327,03-6913-2327
ことぶき薬局梶原店,114-0004,東京都北区堀船3-33-2,35.7516221,139.7489971,,,,,,,,03-3919-0061,03-39190062
フラワー薬局中村橋駅前店,176-0021,東京都練馬区貫井1-7-28,35.7380203,139.6375264,,,,,,,,03-5971-7622,03-5971-7623
内坪薬局,183-0006,東京都府中市緑町2-17-8,35.6724135,139.4901743,,,,,,,,042-367-4988,042-367-4988
あすか薬局狭山ヶ丘店,359-1106,埼玉県所沢市東狭山ヶ丘1-7-1,35.8095399,139.4154699,,,,,,,,04-2929-0180,04-2929-0181
ウエルシア四街道めいわ店,284-0043,千葉県四街道市めいわ3-1-1,35.6519046,140.1688904,,,,,,,,043-433-7011,043-433-7012
薬マツモトキヨシ新宿三丁目Part2店,160-0022,東京都新宿区新宿3-17-2　ﾋｭｰﾘｯｸﾋﾞﾙ新宿三丁目ﾋﾞﾙ,35.6916889,139.7035355,,,,,,,,03-3226-8870,03-3226-8870
ハックドラッグ六ツ川店,232-0066,神奈川県横浜市南区六ツ川2-108-3,35.4259672,139.582742,,,,,,,,045-730-5642,045-730-5643
ナカジマ薬局オンライン調剤センター,060-0010,北海道札幌市中央区北十条西24丁目2-15　ﾅｶｼﾞﾏｸﾞﾙｰﾌﾟ本社ﾋﾞﾙ1階,43.070052,141.3174635,,,,,,,,011-624-6225,011-641-3800
雄飛堂薬局金沢八景店,236-0027,神奈川県横浜市金沢区瀬戸16-32　THE PLACE八景1F,35.3311208,139.6209417,,,,,,,,045-349-5617,045-349-5716
さくら薬局築地店,104-0045,東京都中央区築地1-9-9　細川築地ﾋﾞﾙ8F,35.6689918,139.7712582,,,,,,,,03-3547-3646,03-3547-3647
ウエルシア薬局江東平野店,135-0023,東京都江東区平野3-7-19,35.6781046,139.805805,,,,,,,,03-5639-1225,03-5639-1226
オアシス調剤薬局,512-1212,三重県四日市市智積町城丸6030-2,34.9879937,136.5427434,,,,,,,,059-325-2511,059-325-2522
かえで薬局(熊本),869-0511,熊本県宇城市松橋町字南田2275-6,32.651382,130.69424,,,,,,,,0964-27-5828,0964-27-5829
ひよこ薬局,262-0033,千葉県千葉市花見川区幕張本郷5-4-7　ﾗﾌｧｲｴｯﾄ本郷104,35.6737324,140.0446382,,,,,,,,043-271-1458,043-271-1457
ウエルシアさいたま宮原駅前店,331-0812,埼玉県さいたま市北区宮原町3-372,35.9405656,139.6103383,,,,,,,,048-662-2251,048-662-2252
かすが薬局,362-0074,埼玉県上尾市春日2-24-1,35.9767783,139.5775373,,,,,,,,048-773-9730,048-773-9731
ファーブケア薬局,136-0072,東京都江東区大島8-22-21　ｼｬﾄｰﾚ大島101,35.6895563,139.8406742,,,,,,,,03-5875-4613,03-5875-4870
麻布十番調剤薬局,106-0045,東京都港区麻布十番1-7-1　ﾖｰﾛｯﾊﾟﾊｳｽ1階,35.6566274,139.7346009,,,,,,,,03-6434-9867,03-6434-9868
大賀薬局薬院大通り店,810-0022,福岡県福岡市中央区薬院4-1-27-201,33.5803616,130.3971027,,,,,,,,092-521-7388,092-521-7345
アイン薬局新八千代店,276-0015,千葉県八千代市米本1545-21,35.7515712,140.1124993,,,,,,,,047-480-5630,047-480-5670
ドラッグストアマツモトキヨシ三鷹新川店,181-0004,東京都三鷹市新川1-3-25,35.6669818,139.5774776,,,,,,,,03-3326-5653,03-3326-5653
スギ薬局長良町店,454-0815,愛知県名古屋市中川区長良町2-105　ｱﾗｶﾜﾋﾞﾙ1F,35.1509288,136.8684541,,,,,,,,080-3009-8187,052-364-7652
ウエルシア蓮田黒浜店,349-0101,埼玉県蓮田市黒浜２８１１,35.9945202,139.6635514,,,,,,,,048-765-7037,048-765-7027
日生薬局ひばりが丘店,202-0001,東京都西東京市ひばりが丘３丁目３−１６,35.7435133,139.5355596,,,,,,,,042-452-5454,042-452-5146
薬局トモズ同潤会松江店,132-0025,東京都江戸川区松江2-16-5,35.7029068,139.8727484,,,,,,,,03-5607-7081,03-5607-8121
浦和すばる薬局,330-0053,埼玉県さいたま市浦和区前地3-8-17-103,35.8587956,139.6650551,,,,,,,,048-883-8376,048-883-8376
スギドラッグ藤枝水守店,426-0005,静岡県藤枝市水守3-1-3,34.882346,138.2738989,,,,,,,,080-4151-9272,054-646-8555
ウエルシア南麻布店,106-0047,東京都港区南麻布5-1-11-1F,35.6551219,139.7228906,,,,,,,,03-5793-1271,03-5793-1272
ウエルシア郡山駅東口店,963-8802,福島県郡山市谷島町6-18,37.3962969,140.3950716,,,,,,,,024-941-2615,024-941-2616
薬マツモトキヨシmatsukiyoLAB上大岡店,233-0002,神奈川県横浜市港南区上大岡西1-6-1,35.4090381,139.5966154,,,,,,,,045-846-2830,045-846-2830
阪神調剤薬局二条店,604-8415,京都府京都市中京区西ノ京栂尾町3番地JR二条駅東NKﾋﾞﾙ1F,35.0106849,135.7416332,,,,,,,,075-803-2961,075-803-2962
カワチ薬品石井町店,321-0912,栃木県宇都宮市石井町2800-155,36.5467058,139.9281642,,,,,,,,028-683-4773,028-683-4774
クリエイトSD栄本郷台店*,244-0842,神奈川県横浜市栄区飯島町2482,35.373999,139.5436204,,,,,,,,045-890-2677,045-890-2678
大久保薬局,031-0022,青森県八戸市糠塚大杉平４−５,40.498337,141.4814513,,,,,,,,0178-43-9716,0178-43-9716
セキ薬局南古谷店,350-0023,埼玉県川越市並木854-6,35.8999518,139.5198213,,,,,,,,049-293-3877,049-293-3877
アイン薬局白石南郷店,003-0022,北海道札幌市白石区南郷通1丁目南8-10,43.0455023,141.3969212,,,,,,,,011-595-7382,011-595-7383
なの花薬局西荻南店,167-0053,東京都杉並区西荻南1丁目1番1号　西荻南ﾒﾃﾞｨｶﾙﾓｰﾙ1階,35.6952658,139.6035292,,,,,,,,03-5344-3060,03-5344-3061
薬局サンファーマシー,565-0851,大阪府吹田市千里山西1-38-21,34.7782479,135.505271,,,,,,,,06-6386-2488,06-6386-2488
クオール薬局狛江2号店,201-0014,東京都狛江市東和泉1-18-1,35.6321222,139.5777672,,,,,,,,03-5761-2218,03-5761-8381
アイセイ薬局南柏店,277-0075,千葉県柏市南柏中央1-6　宇佐美ﾋﾞﾙ1F,35.8440358,139.9533124,,,,,,,,04-7171-5522,04-7171-5523
スギ薬局福井田原町店,910-0017,福井県福井市文京2-2-3,36.0757698,136.2177406,,,,,,,,080-4910-9864,0776-43-9367
けやき薬局510店,980-0014,宮城県仙台市青葉区本町2-4-8,38.2638889,140.8733854,,,,,,,,0227-96-4364,022-796-4366
あざみ薬局,270-2253,千葉県松戸市日暮5-195　ｸﾞﾗﾝﾃﾞｨｽ新八柱,35.7903562,139.9396135,,,,,,,,047-311-1700,047-311-1702
ウエルシア東大阪東山店,579-8027,大阪府東大阪市東山町3-5,34.678475,135.641458,,,,,,,,072-980-8270,072-980-8271
ウエルシア行田佐間店,361-0032,埼玉県行田市佐間1-5-5,36.1327618,139.4651716,,,,,,,,048-564-6778,048-564-6777
スズキ調剤薬局,520-2144,滋賀県大津市大萱1-16-1　ｱﾊﾟﾎﾃﾙ1F,34.9860303,135.9258192,,,,,,,,077-543-3331,077-543-3332
ウエルシア日高高萩店,350-1216,埼玉県日高市武蔵高萩3-13-1,35.9046997,139.3738947,,,,,,,,042-978-9386,042-978-9387
ウエルシア静岡羽鳥店*,421-1215,静岡県静岡市葵区羽鳥2-21-20,34.9797729,138.343045,,,,,,,,054-276-0611,054-276-0612
きらり月島薬局,104-0052,東京都中央区月島1-8-1-104,35.6644337,139.7833007,,,,,,,,03-3533-0908,03-3533-0908
クオール薬局下高井戸店,156-0043,東京都世田谷区松原3-28-9,35.6658329,139.6420908,,,,,,,,03-3327-9133,03-3327-9233
ナチュラルローソンクオール薬局芝大門1丁目店,105-0012,東京都港区芝大門1-6-3,35.6581775,139.7542326,,,,,,,,03-5425-1389,03-5425-1390
トモズ神谷町店*,105-0001,東京都港区虎ノ門5-1-5ﾒﾄﾛｼﾃｨ神谷町B1F,35.6636829,139.7452962,,,,,,,,03-5425-2977,03-5425-2978
新薬堂薬局,273-0035,千葉県船橋市本中山2-15-12,35.7154029,139.9440075,,,,,,,,047-334-2407,047-334-2429
スギ薬局日本大通り店,231-0005,神奈川県横浜市中区本町1-4　ﾌﾟﾗｲﾑﾒｿﾞﾝ横濱日本大通1F,35.4479878,139.6410502,,,,,,,,045-264-6271,045-264-6272
ハックドラッグ能見台駅前店*,236-0053,神奈川県横浜市金沢区能見台通5-10,35.3604319,139.6287415,,,,,,,,045-790-1215,045-790-1216
ウエルシア小山雨ヶ谷店,323-0826,栃木県小山市雨ケ谷802-3,36.2827493,139.8182753,,,,,,,,0285-31-3580,0285-31-3581
ウエルシア千葉武石店,262-0031,千葉県千葉市花見川区武石町2-616,35.6627884,140.0615033,,,,,,,,043-350-3412,043-350-3413
スギ薬局豊中春日店,560-0052,大阪府豊中市春日町4-1-35,34.811677,135.4681193,,,,,,,,070-3268-0860,0800-919-7470
ニコニコ薬局赤坂店,107-0052,東京都港区赤坂5-4-8　荒島ﾋﾞﾙ1Ｆ,35.6718619,139.7357049,,,,,,,,03-6426-5157,03-6426-5158
ミネ薬局笹塚店,151-0073,東京都渋谷区笹塚2-12-15　石原ﾋﾞﾙ1Ｆ,35.6751937,139.6679997,,,,,,,,03-3377-1038,03-3377-1038
日本調剤福岡中央薬局,810-0001,福岡県福岡市中央区天神1-2-12　ﾒｯﾄﾗｲﾌ天神ﾋﾞﾙ1Ｆ,33.5890182,130.4029531,,,,,,,,092-738-3188,092-738-3189
ドラッグストアマツモトキヨシ上永谷店,233-0013,神奈川県横浜市港南区丸山台3-1-7,35.4007377,139.5703643,,,,,,,,045-848-0207,045-848-0207
アイセイ薬局南柏店,277-0075,千葉県柏市南柏中央1-6　宇佐美ﾋﾞﾙ1F,35.8440358,139.9533124,,,,,,,,04-7171-5522,04-7171-5523
山松薬局,113-0022,東京都文京区千駄木2-33-9,35.7245908,139.7631461,,,,,,,,03-5834-2680,03-5834-2681
そうごう薬局二子玉川店,158-0094,東京都世田谷区玉川3-15-1　esprit　chocolat　1F,35.6140357,139.625585,,,,,,,,03-3708-7381,03-37008-7382
コストコホールセール八幡倉庫店薬局,614-8294,京都府八幡市欽明台北5番地,34.841025,135.7183493,,,,,,,,075-971-3705,075-971-3714
オレンジ薬局池袋西口店,171-0021,東京都豊島区西池袋1-16-10,35.7307728,139.7092991,,,,,,,,03-6912-6180,03-6912-6175
イオン薬局板橋前野町店,174-0063,東京都板橋区前野町4-21-22,35.7712039,139.6917358,,,,,,,,03-5916-8120,03-5916-8121
スギ薬局立川栄町店,190-0003,東京都立川市栄町五丁目36-1,35.716455,139.4248129,,,,,,,,080-3728-0998,042-534-9141
