name,post,address,lat,lng,monday,tuesday,wednesday,thursday,friday,saturday,sunday,tel,fax
エスケー薬局調布ヶ丘店,182-0021,東京都調布市調布ヶ丘3-19-12,35.6568612,139.5516865,,,,,,,,042-480-3322,042-480-3323
さくら薬局和白病院前店,813-0041,福岡県福岡市東区和白丘2-2-68,33.6927419,130.4342545,,,,,,,,092-607-3771,092-605-5010
サカエ薬局駅前店,120-0026,東京都足立区千住旭町1-14,35.7481446,139.8056446,,,,,,,,03-6812-0631,03-6812-0785
スギ薬局東五反田店,141-0022,東京都品川区東五反田2-3-5五反田中央ﾋﾞﾙ1階,35.6254792,139.7264443,,,,,,,,03-6456-3258,03-6456-3259
さくら薬局横浜西口天理ビル店,220-0004,神奈川県横浜市西区北幸１丁目４−１ 横浜天理ビル B1F,35.4674431,139.61964,,,,,,,,045-319-3257,045-319-3259
アイン薬局新さっぽろデュオ店,004-0052,北海道札幌市厚別区厚別中央2条5-6-3　新さっぽろｱｰｸｼﾃｨduo-2 4F,43.0387125,141.4733193,,,,,,,,011-376-0037,011-376-0038
セイムス小田急相模原駅前薬局,252-0314,神奈川県相模原市南区南台5-11-19　ﾍﾟｱﾅｰﾄﾞｵﾀﾞｻｶﾞ107,35.5155483,139.4213356,,,,,,,,042-705-4891,042-705-4892
ウエルシア松戸元山店,270-2212,千葉県松戸市五香南1-1-5,35.7915538,139.9733172,,,,,,,,047-706-2413,047-385-2410
スギ薬局赤坂店,107-0052,東京都港区赤坂5-5-13-1階,35.6703806,139.733781,,,,,,,,03-3568-7927,03-3584-9097
そうごう薬局麻布台ヒルズ店,106-0041,東京都港区麻布台1-3-1　麻布台ﾋﾙｽﾞﾀﾜｰﾌﾟﾗｻﾞ4階,35.6609166,139.7405604,,,,,,,,03-5544-9351,03-5544-9352
かいがら坂薬局,244-0842,神奈川県横浜市栄区飯島町1374,35.3752748,139.5403405,,,,,,,,045-891-4564,045-891-4564
ウエルシア八千代大和田2号店,276-0046,千葉県八千代市大和田新田446-47,35.7271087,140.0844902,,,,,,,,047-450-2130,047-450-2131
フレンド薬局風ノ宮,321-0967,栃木県宇都宮市錦1-565-6,36.5701577,139.8946619,,,,,,,,028-666-8082,028-666-8535
クオール薬局シティテラスモール金町店,125-0051,東京都葛飾区新宿6-2-15　ｼﾃｨﾃﾗｽﾓｰﾙ金町,35.7696899,139.8635641,,,,,,,,03-6231-3189,03-5876-5690
セリア薬局,739-0007,広島県東広島市西条土与丸6-1-3,34.427655,132.7522401,,,,,,,,082-423-7100,082-423-7100
アップル薬局東金店,283-0005,千葉県東金市田間2-22-8,35.5660945,140.370253,,,,,,,,0475-53-6972,0475-53-6973
スギ薬局弦巻店,154-0016,東京都世田谷区弦巻3-8-12-1階,35.634227,139.6453436,,,,,,,,03-5426-3685,03-3420-5150
イルカ薬局那珂店,812-0893,福岡県福岡市博多区那珂1-44-16,33.5703926,130.4350964,,,,,,,,092-433-6661,092-433-6667
さいた薬局よこて町店,013-0061,秋田県横手市横手町字四ノ口42,39.3142923,140.5520106,,,,,,,,0182-33-6662,0182-33-0202
薬マツモトキヨシ東急北越谷店,343-0025,埼玉県越谷市大沢3-6-1　東急ｽﾄｱ北越谷店,35.9019685,139.7806713,,,,,,,,048-970-5510,048-970-5510
スギドラッグ厚木中町店,243-0018,神奈川県厚木市中町3-4-22　1階,35.4400246,139.3630288,,,,,,,,070-1380-9376,046-204-7740
高取調剤薬局,814-0011,福岡県福岡市早良区高取1-1-34　油屋ﾋﾞﾙ2階B号,33.5814438,130.3516423,,,,,,,,092-822-3816,092-400-1324
アスト薬局巣鴨店,170-0002,東京都豊島区巣鴨1-20-10　宝生第一ﾋﾞﾙ2階,35.7312531,139.7408634,,,,,,,,03-6902-0690,03-6902-0691
スギ薬局岩本町店,101-0032,東京都千代田区岩本町3-8-16　NMF神田岩本町ﾋﾞﾙ1F,35.6957561,139.7773091,,,,,,,,080-7533-5170,03-5823-4962
ハックドラックシァル鶴見調剤薬局,230-0051,神奈川県横浜市鶴見区鶴見中央１丁目１−２,35.50784603,139.676828,,,,,,,,045-508-5890,045-508-5891
さんあい薬局ハンター店,513-0806,三重県鈴鹿市算所2-5-1鈴鹿ﾊﾝﾀｰｼｮｯﾋﾟﾝｸﾞセンター1F,34.8734592,136.54639,,,,,,,,059-373-6177,059-373-6178
薬局マツモトキヨシ八千代緑が丘西店,276-0040,千葉県八千代市緑が丘西5-1-2,35.7411198,140.066845,,,,,,,,047-450-7500,047-450-7500
スギドラッグ相川店,458-0011,愛知県名古屋市緑区相川3-250-2,35.0985985,136.9780433,,,,,,,,052-879-2025,052-877-7150
ガーデン薬局河原口店,243-0433,神奈川県海老名市河原口2-30-27,35.449752,139.3773904,,,,,,,,046-259-5189,046-259-5191
さくら薬局板橋蓮沼店,174-0052,東京都板橋区蓮沼町20-12,35.7687792,139.7032733,,,,,,,,03-3558-0860,03-5948-7385
さつき薬局本店,314-0030,茨城県鹿嶋市厨4-2-8,35.9749749,140.62684,,,,,,,,0299-85-2131,0299-85-2132
調剤薬局ツルハドラッグライズモール綾瀬店,252-1107,神奈川県綾瀬市深谷中7-18-2,35.4358294,139.4420268,,,,,,,,0467-33-6323,0467-33-6323
ウエルシア薬局名古屋丸の内2丁目店,460-0002,愛知県名古屋市中区丸の内2-16-8　2F,35.1749171,136.8977926,,,,,,,,052-218-3672,052-218-3673
大賀薬局徳洲会病院前店,816-0872,福岡県春日市桜ヶ丘4-18,33.5437667,130.4484472,,,,,,,,092-588-8831,0120-205-855
チューリップ大泉本町薬局,939-8094,富山県富山市大泉本町2-3-15,36.6770145,137.2253631,,,,,,,,076-420-5105,076-420-5106
クリエイトSD横須賀根岸店,239-0807,神奈川県横須賀市根岸町3-16-35,35.252548,139.6834005,,,,,,,,046-838-6227,046-838-6228
ウエルシア寝屋川池田東町店,572-0033,大阪府寝屋川市池田東町7-12,34.7681781,135.6177063,,,,,,,,072-830-2172,072-830-2173
ハート薬局柳原店,936-0023,富山県滑川市柳原26-6,36.7625297,137.3538395,,,,,,,,076-475-8611,0120-969-855
スギ薬局和光店,351-0101,埼玉県和光市白子3-17-30,35.7923055,139.636999,,,,,,,,070-3166-0972,048-462-2015
スギ薬局中野駅北店,165-0026,東京都中野区新井1-1-5　中央ﾏﾝｼｮﾝ1階,35.7099862,139.6695043,,,,,,,,070-1421-9523,03-6454-0852
スギ薬局都島毛馬店,534-0001,大阪府大阪市都島区毛馬町2-10-1,34.7203857,135.5233574,,,,,,,,070-3156-2992,06-6922-6828
さくら薬局横代店,802-0821,福岡県北九州市小倉南区横代北町１丁目３−４,33.83969466,130.8953648,,,,,,,,093-963-8737,093-963-8738
クリエイトS・D横須賀根岸町店,239-0807,神奈川県横須賀市根岸町3-16-35,35.252548,139.6834005,,,,,,,,0468-38-6227,0468-38-6228
クリエイト薬局港北綱島東店,223-0052,神奈川県横浜市港北区綱島東2-2-14,35.5381524,139.6365481,,,,,,,,045-543-5112,045-543-5113
ヤックスドラッグ茂原小林薬局,297-0074,千葉県茂原市小林1633,35.4381682,140.2843675,,,,,,,,0475-36-7236,0475-36-7237
ハロー薬局元植田店,468-0009,愛知県名古屋市天白区元植田2-304-4,35.1342398,136.9910333,,,,,,,,052-800-2801,052-800-2802
スギヤマ薬局植田店,468-0009,愛知県名古屋市天白区元植田1-906,35.1378604,136.9896204,,,,,,,,052-807-6601,052-807-6603
ココカラファイン薬局杉並堀ノ内店,166-0013,東京都杉並区堀ノ内2-29-14　ﾗｲｵﾝｽﾞﾏﾝｼｮﾝ新高円寺1F,35.6903262,139.6535388,,,,,,,,03-3313-4622,03-3313-5104
調剤薬局ツルハドラッグ北4条店,060-0004,北海道札幌市中央区北４条西18-8-1　ﾌﾟﾚﾐｱﾑｶﾞｰﾃﾞﾝ北円山1F,43.0631012,141.3273888,,,,,,,,011-213-9332,011-213-9332
ウエルシア神栖大野原店,314-0144,茨城県神栖市大野原3-9-36,35.8970469,140.643718,,,,,,,,0299-95-5680,0299-95-5681
なかむら薬局,185-0021,東京都国分寺市南町3-9-25　都営国分寺三丁目団地C棟111号,35.6983927,139.4807364,,,,,,,,042-321-5911,042-325-6762
ウエルシア薬局東京ミッドタウン八重洲店,104-0028,東京都中央区八重洲2-2-1　東京ﾐｯﾄﾞﾀｳﾝ八重洲B1,35.6794084,139.7689311,,,,,,,,03-6281-6922,03-6281-6923
あきつき薬局三島駅前店,411-0036,静岡県三島市一番町15-21　ﾏｽﾀﾞﾋﾞﾙ2階,35.1253458,138.9121649,,,,,,,,055-955-6682,055-955-6683
下山薬局駅前店,014-0022,秋田県大仙市大花町14-14,39.467526,140.4791511,,,,,,,,0187-73-8315,0187-73-8316
日本調剤鶴見西口薬局,230-0062,神奈川県横浜市鶴見区豊岡町17-2　互省ﾋﾞﾙ1階,35.5092048,139.675793,,,,,,,,045-947-2430,045-947-2431
杏林堂ドラッグストア上島駅前店,433-8122,静岡県浜松市中央区上島3-28-10,34.741422,137.7467748,,,,,,,,053-467-6811,053-467-6812
スギ薬局交野店,576-0041,大阪府交野市私部西1-33-20　じゃんぼｽｸｴｱ交野店1階,34.7857432,135.6744224,,,,,,,,072-3167-2085,0800-222-0628
なの花薬局草津野村店,525-0027,滋賀県草津市野村6-1-3　ｺﾝﾌｫｰﾚT1-1F,35.0265877,135.9545719,,,,,,,,077-566-5011,077-566-5022
龍生堂薬局四谷三丁目店,160-0004,東京都新宿区四谷3-12　ｻﾜﾉﾎﾞﾘ･ﾋﾞﾙﾃﾞｨﾝｸﾞ1F,35.6875501,139.7196213,,,,,,,,03-5368-3042,03-5368-3043
薬樹薬局富岡,236-0051,神奈川県横浜市金沢区富岡東5-18-1　長谷川ﾒﾃﾞｨｶﾙﾌﾟﾗｻﾞ富岡1F,35.3674942,139.6315203,,,,,,,,045-778-7851,045-778-7852
ウエルシア薬局右京西院月双店,615-0054,京都府京都市右京区西院月双町22,34.9995296,135.7224174,,,,,,,,075-316-6555,075-316-6556
薬局トモズ白山店,113-0001,東京都文京区白山1-33-16　ﾊﾟｰｸｺｰﾄﾌﾟﾚｲｽ1F,35.7207504,139.7522293,,,,,,,,03-5801-0752,03-5801-0753
ウエルシア佐倉寺崎店,285-0819,千葉県佐倉市寺崎北1-7-3,35.7106873,140.2191407,,,,,,,,043-483-7611,043-483-7612
ウエルシア我孫子下ヶ戸店,270-1138,千葉県我孫子市下ケ戸478-1,35.8703253,140.0521086,,,,,,,,04-7165-2015,04-7165-2016
ウエルシア薬局越谷宮本店,343-0806,埼玉県越谷市宮本町1-178,35.8907792,139.7812635,,,,,,,,048-960-2111,048-960-2112
サカエ薬局岡山駅前店*,700-0901,岡⼭県岡⼭市北区本町1-3,34.665231,133.9198246,,,,,,,,086-230-1605,086-230-1606
クリエイト薬局平塚桜ヶ丘店,254-0055,神奈川県平塚市上平塚 1-70,35.331265,139.3264848,,,,,,,,0463-37-4534,0463-37-4535
ウエルシア北柏2号店,277-0832,千葉県柏市北柏4-5-14,35.8697795,139.9885698,,,,,,,,04-7157-0977,04-7157-0978
クリエイトSD倉見才戸店,253-0101,神奈川県高座郡寒川町倉見2072-1,35.3962521,139.3830864,,,,,,,,0467-74-9372,0467-74-9373
ウエルシア薬局郡山小原田店,963-8735,福島県郡山市小田原3-3-14,37.4004776,140.3596822,,,,,,,,024-941-3618,024-941-3628
ヤックスドラッグ富里インター薬局,286-0221,千葉県富里市七栄575-264,35.7397533,140.3152669,,,,,,,,0476-90-5121,0476-90-5122
稲垣薬局川崎店,212-0016,神奈川県川崎市幸区南幸町2-40,35.5345776,139.6902699,,,,,,,,044-542-8138,044-548-8137
セキ薬局藤金店,350-2206,埼玉県鶴ヶ島市藤金897-5,35.9450566,139.4029325,,,,,,,,049-292-0414,049-292-0414
西薬局京橋店,534-0024,大阪府大阪市都島区東野田町1-16-11-101,34.6973872,135.5290851,,,,,,,,06-6357-7788,06-6357-7789
森川薬局青葉台店,739-0401,広島県廿日市市福面2-2-3,34.3188995,132.2990564,,,,,,,,0829-30-6778,0829-30-6778
スギ薬局北久宝寺店,541-0057,大阪府大阪市中央区北久宝寺町1-9-1,34.6801885,135.5072927,,,,,,,,080-4744-9692,06-6263-0275
旭川いづみ調剤薬局,070-0034,北海道旭川市4条通10-2233-6,43.7682806,142.3647726,,,,,,,,0166-25-1238,0166-25-1237
薬マツモトキヨシ御茶ノ水駿河台店,101-0062,東京都千代田区神田駿河台2-1,35.69953099,139.7650302,,,,,,,,03-3291-0221,03-3291-0221
スギ薬局藤岡店,470-0431,愛知県豊田市西中山町牛田63-1,35.1513114,137.1784856,,,,,,,,080-4171-5763,0565-75-3161
アイン薬局赤坂溜池店,107-0052,東京都港区赤坂2-11-15　MY赤坂ﾋﾞﾙ1F,35.6701941,139.7439264,,,,,,,,03-3568-7030,03-3583-7288
サンキュードラッグ高須薬局,808-0145,福岡県北九州市若松区高須南1-8-27,33.888004,130.6933801,,,,,,,,093-742-7739,093-742-7840
ゆたか調剤薬局,857-0871,長崎県佐世保市本島町2-16,33.1715083,129.7225287,,,,,,,,0956-22-0363,0956-25-9993
ドラッグセイムス大網みずほ台薬局,299-3234,千葉県大網白里市みずほ台2-1-2,35.5146416,140.3047059,,,,,,,,0475-86-7507,0475-86-7508
日本調剤近江八幡薬局,523-0082,滋賀県近江八幡市土田町1396-1,35.1254234,136.0906277,,,,,,,,0748-29-3611,0748-29-3612
ツルハ薬局福岡松島店,812-0062,福岡県福岡市東区松島1-40-3,33.6251866,130.436182,,,,,,,,092-624-1847,092-624-1848
セキ薬局東宮下店,337-0012,埼玉県さいたま市見沼区東宮下332-1,35.9287305,139.6774319,,,,,,,,048-797-8250,048-797-8250
薬局ドラッグ・ジロー,279-0043,千葉県浦安市富士見2-9-1,35.6523068,139.8913896,,,,,,,,047-350-6700,047-350-6767
サンハート薬局金山店,456-0011,愛知県名古屋市熱田区花町2-5　SOLAO金山1階,35.1399096,136.9014353,,,,,,,,052-683-6117,052-683-6118
V・drug江東あんしん薬局,136-0074,東京都江東区東砂7-19-13　ﾍﾞﾙｺﾓﾝ南砂101号,35.6729966,139.8362809,,,,,,,,03-5633-7877,03-5633-7870
オカノ薬局パピオス西店,673-0891,兵庫県明石市大明石町1-6-1　ﾊﾟﾋﾟｵｽ3F,34.6479754,134.9920241,,,,,,,,078-915-8577,078-915-8578
ツルハドラッグ仙台通り店,981-0915,宮城県仙台市青葉区通町1丁目4番34号,38.2778009,140.8654773,,,,,,,,022-725-4267,022-725-4267
なごみ薬局上高田店,164-0002,東京都中野区上高田1-8-13,35.7115491,139.6784757,,,,,,,,03-5942-6080,03-5942-6080
薬局マツモトキヨシ湖北台店,270-1132,千葉県我孫子市湖北台9-6-16,35.8656229,140.067286,,,,,,,,04-7110-0350,04-7110-0350
さくら薬局我孫子店,270-1166,千葉県我孫子市我孫子1861,35.8648325,140.0274801,,,,,,,,04-7170-2316,04-7170-2782
キリン堂大阪福島店,553-0003,大阪府大阪市福島区福島2-1-34,34.6935194,135.4873032,,,,,,,,06-4797-6600,06-4797-6601
スギ薬局フレスポ桶川店,363-0018,埼玉県桶川市坂田西1-4-1,36.0119449,139.5735317,,,,,,,,080-7533-6552,048-782-8735
薬局日本メディカル武蔵小金井店,184-0004,東京都小金井市本町1-18-3,35.700271,139.5075824,,,,,,,,0423-16-5407,0423-16-5408
小新白鳥薬局,950-2023,新潟県新潟市西区小新5-8-66,37.8813435,139.0016332,,,,,,,,025-378-2005,025-378-2006
イオン薬局日の出店,190-0182,東京都西多摩郡日の出町大字平井237-3　ｲｵﾝﾓｰﾙ1階,35.7354516,139.275176,,,,,,,,042-588-8250,042-588-8253
調剤薬局ツルハドラッグ千葉中央3丁目店,260-0013,千葉県千葉市中央区中央3-3-1,35.6088742,140.1214366,,,,,,,,043-202-2268,043-202-2268
ミネ薬局聖蹟桜ヶ丘店,206-0011,東京都多摩市関戸1-1-5　ｻﾞ･ｽｸｴｱ2F,35.6516463,139.4458812,,,,,,,,042-400-5601,042-400-5602
スギ薬局玉垣店,513-0816,三重県鈴鹿市南玉垣町３０１３,34.85519531,136.5900095,,,,,,,,090-3919-2875,059-373-5432
マリン薬局大塚店,880-0951,宮崎県宮崎市大塚町原ノ前1580-4,31.9206582,131.3956588,,,,,,,,0985-63-4711,0985-63-4712
クオール薬局調布駅前店,182-0026,東京都調布市小島町1-36-16ｸﾞﾚｰｼｱ調布1F,35.6527203,139.5428767,,,,,,,,042-426-9889,042-426-9890
牡丹山薬局,950-0872,新潟県新潟市東区牡丹山1-5-12-9,37.9169185,139.0898788,,,,,,,,025-256-6377,025-256-6377
飯田薬局江田店,225-0015,神奈川県横浜市青葉区荏田北1-2-1,35.5583357,139.550837,,,,,,,,045-911-6654,045-911-6605
ミント薬局下祇園店,731-0138,広島県広島市安佐南区祇園3-7-2 1階,34.4417238,132.4615744,,,,,,,,082-962-0900,082-962-0910
錦二丁目薬局,460-0003,愛知県名古屋市中区錦2-6-1,35.1719958,136.899758,,,,,,,,052-253-6971,052-253-6972
ツルハドラック南花屋敷店,666-0026,兵庫県川西市南花屋敷3-16-9,34.8189003,135.4019852,,,,,,,,072-759-8388,072-759-8388
フクシ学園薬局,274-0060,千葉県船橋市坪井東2-13-29,35.7291241,140.0599153,,,,,,,,047-490-2950,047-490-2951
カワチ薬品千代田店,315-0052,茨城県かすみがうら市下稲吉2633-7,36.1239941,140.2313623,,,,,,,,029-830-2930,029-830-2931
ウエルシア薬局葛飾水元店,125-0032,東京都葛飾区水元4-10-23,35.786043,139.8619521,,,,,,,,03-3826-6421,03-3826-6422
アーク調剤薬局ながの東急店,380-8539,長野県長野市南千歳1-1-1　ながの東急百貨店本館6F,36.6450515,138.1886757,,,,,,,,026-217-4203,026-217-4204
ウエルシア薬局大分セントポルタ中央町店,870-0035,大分県大分市中央町1-3-2,33.2364164,131.6069904,,,,,,,,097-513-0091,097-513-0092
新生堂薬局島崎店,860-0073,熊本県熊本市西区島崎2-22-29,32.8083638,130.6911172,,,,,,,,096-322-9911,096-324-6561
レジーナ薬局浦和駅前店,330-0063,埼玉県さいたま市浦和区高砂2-7-7ｾﾌﾞﾝﾋﾞﾙ1階,35.8585243,139.6551134,,,,,,,,0120-597-707,0120-597-708
稲垣薬局荻窪店,167-0035,東京都杉並区今川2-5-11,35.7155492,139.6078871,,,,,,,,03-4241-3338,03-4241-3348
スギ薬局小松中央店,923-0868,石川県小松市日の出町2-165,36.4015103,136.4581889,,,,,,,,080-7557-3004,0761-58-1265
さくら薬局大手町店,100-0004,東京都千代田区大手町1-5-5大手町ﾀﾜｰ地下1階,35.6855113,139.765352,,,,,,,,03-6268-0156,03-6268-0157
ことのは薬局,854-0072,長崎県諫早市永昌町12-1,32.8518193,130.040438,,,,,,,,0957-47-6430,0957-47-6431
杏林堂薬局静岡大坪店,422-8075,静岡県静岡市駿河区大坪町13-5,34.9636488,138.398105,,,,,,,,054-281-7611,054-281-7612
大手前薬局JR玉造駅ビル店,537-0024,大阪府大阪市東成区東小橋1-9-19　JR玉造駅NKﾋﾞﾙ1F,34.673412,135.5331137,,,,,,,,06-6981-2700,06-6981-3200
スギ薬局新宿御苑店,160-0022,東京都新宿区新宿2-8-8　ｱｲ･ｱﾝﾄﾞ･ｲｰ新宿ﾋﾞﾙ1F,35.6893434,139.7087799,,,,,,,,080-4899-0191,03-5341-4993
アイセイ薬局川口駅西口,332-0015,埼玉県川口市川口6-2-1　1階,35.8027033,139.7110998,,,,,,,,048-271-4600,048-257-5220
さくら薬局八千代台村上南店,276-0029,千葉県八千代市村上南5-5-18,35.7203951,140.1202474,,,,,,,,047-405-7177,047-405-7178
白数薬局,604-8467,京都府京都市中京区西ノ京大炊御門町8-4,35.0208986,135.7285308,,,,,,,,075-461-1473,075-461-1523
ミドリ薬局イズミ店,461-0001,愛知県名古屋市東区泉1-8-5　あいさきがけ1F,35.17709,136.9119742,,,,,,,,052-957-5525,052-957-5526
緑橋調剤薬局,070-0033,北海道旭川市3条通9-551-1,43.7668224,142.3617831,,,,,,,,0166-27-3311,0166-27-3799
スター薬局,114-0014,東京都北区田端6-3-1,35.7383306,139.758587,,,,,,,,03-3821-2219,03-5809-0828
スギ薬局練馬早宮店*,179-0085,ﾌｨｵｰﾚ豊島園1　1階001号室,35.7471081,139.6481493,,,,,,,,03-6914-6878,03-6914-6879
トマト薬局,134-0083,東京都江戸川区中葛西3-11-23,35.6653633,139.8687861,,,,,,,,03-5696-6065,03-5696-6090
ウエルシア薬局名古屋曽根店,458-0035,愛知県名古屋市緑区曽根2-437,35.0730985,136.956672,,,,,,,,052-629-1691,052-629-1692
ウエルシア薬局仙台泉高森店,981-3203,宮城県仙台市泉区高森4-2-539,38.3327272,140.8474053,,,,,,,,022-342-7550,022-342-7551
クリエイトSD幸田大草店,444-0103,愛知県額田郡幸田町大草赤石28-1,34.875489,137.1769701,,,,,,,,0564-56-3012,0564-56-3013
ウエルシア薬局市原五井店,290-0056,千葉県市原市五井5492-2,35.5189762,140.0899024,,,,,,,,0436-26-8281,0436-26-8280
ウメザワ薬局,115-0055,東京都北区赤羽西2-21-16,35.7719913,139.7211883,,,,,,,,03-3900-3881,03-3900-3883
アール薬局,630-0245,奈良県生駒市北新町10-36-406号,34.6941696,135.6976997,,,,,,,,0743-71-6026,0743-73-5207
新生堂薬局清川店,810-0005,福岡県福岡市中央区清川3-14-7,33.5763829,130.4136468,,,,,,,,092-534-7654,092-534-7655
スギ薬局下新城店,211-0042,神奈川県川崎市中原区下新城2-6-6,35.5778136,139.6330155,,,,,,,,080-7628-2776,044-799-0336
長嶺薬局,881-0011,宮崎県西都市有吉町1-3,32.1074237,131.4056738,,,,,,,,0983-43-0107,0983-43-0231
ウエルシア薬局相模原清新店,252-0216,神奈川県相模原市中央区清新8-3-1,35.5717768,139.3621675,,,,,,,,042-730-4295,042-730-4297
ハナミズキ薬局,359-1141,埼玉県所沢市小手指町1-11-4,35.8034124,139.4384135,,,,,,,,04-2929-6644,04-2929-6645
きりん薬局西荻窪店,167-0054,東京都杉並区松庵3-20-10Masutlife西荻窪Annex1F,35.7031441,139.5954143,,,,,,,,03-5941-3771,03-5941-3779
おはな薬局,525-0023,滋賀県草津市平井1-18-4,35.0313043,135.9585881,,,,,,,,077-567-0871,077-567-0871
スギ薬局藤方店,514-0815,三重県津市藤方1920番地,34.6938607,136.51284,,,,,,,,059-213-6951,059-213-6952
中日調剤薬局中村店,453-0821,愛知県名古屋市中村区大宮町1-31-2,35.1669302,136.8654178,,,,,,,,052-486-1505,052-486-1506
そうごう薬局大倉山店,222-0002,神奈川県横浜市港北区師岡町1148-101,35.5253281,139.6330056,,,,,,,,045-547-9331,045-547-9332
アカネサポート薬局,351-0023,埼玉県朝霞市溝沼五反田1338-1,35.8102546,139.5940242,,,,,,,,048-423-7455,048-423-7057
オーケーサガン店薬局,144-0055,東京都大田区仲六郷2-43-2,35.5504613,139.7157924,,,,,,,,03-6424-5124,03-6424-5240
イオンフードスタイル鴨居店薬局,226-0003,神奈川県横浜市緑区鴨居1-6-1,35.510649,139.5688212,,,,,,,,045-934-6550,045-934-6601
クリエイト薬局新鴨志田店,227-0033,神奈川県横浜市青葉区鴨志田町504-8,35.5599331,139.5065498,,,,,,,,045-960-4101,045-960-4102
クリエイト薬局開成町店,258-0025,神奈川県足柄郡開成町円通寺35-1,35.3341191,139.1194383,,,,,,,,0465-85-1502,0465-85-1503
豊見城薬局,901-0244,沖縄県豊見城市宜保266-21,26.1762881,127.6769243,,,,,,,,098-852-2811,098-850-2415
いちご薬局,861-1112,熊本県合志市幾久富1866-1337,32.8655267,130.7740315,,,,,,,,096-248-7915,096-248-7988
よつば薬局糀谷店,144-0047,東京都大田区萩中2-8-10,35.5516381,139.7299433,,,,,,,,03-6423-7319,03-6423-7318
ウエルシア守谷松並店,302-0131,茨城県守谷市ひがし野4-1-9,35.9556565,139.9915512,,,,,,,,0297-21-0321,0297-21-0322
マルエ薬局前橋天川原店,371-0803,群馬県前橋市天川原1-21-1,36.3756776,139.0838395,,,,,,,,027-289-6262,027-289-6264
ウエルシア四街道大日桜ヶ丘店,284-0001,千葉県四街道市大日54-11,35.6692765,140.1553947,,,,,,,,043-420-0033,043-420-0034
クスリのアオキ菰野薬局,510-1311,三重県三重郡菰野町大字永井3093-30,35.0388162,136.5300945,,,,,,,,059-327-5865,059-327-5866
トロン薬局花ヶ島,885-0057,宮崎県宮崎市桜町4-16,31.9515436,131.4366827,,,,,,,,0985-65-6262,0985-65-6261
ヤマザワ調剤薬局杜のまち店,981-3628,宮城県黒川郡大和町杜の丘1-16,38.3852472,140.8687065,,,,,,,,022-342-1886,022-342-1887
いちご薬局,740-0034,山口県岩国市南岩国町2-77-22,34.1384827,132.1928444,,,,,,,,082-734-1110,082-732-6776
クスリのアオキ西大宮店,331-0078,埼玉県さいたま市西区西大宮4-26-3,35.9308719,139.5756753,,,,,,,,048-657-8773,048-782-5852
ひまわり薬局,275-0016,千葉県習志野市津田沼3-23-12,35.6880534,140.0270573,,,,,,,,047-403-4193,047-403-6680
ハーブランド薬局東松戸店,270-0025,千葉県松戸市東松戸3-7-19,35.7698547,139.9419021,,,,,,,,047-312-8787,047-312-8788
日本調剤元町薬局,231-0023,神奈川県横浜市中区山下町273　JPT元町ﾋﾞﾙ1F,35.4404096,139.6442129,,,,,,,,045-225-8406,045-225-8407
スギ薬局立川柴崎店,190-0023,東京都立川市柴崎町3-4-10　小川ﾋﾞﾙ1階,35.6966009,139.4148986,,,,,,,,080-7603-3872,042-518-9802
すこやか薬局久米店,900-0033,沖縄県那覇市久米2-10-1ｼｬﾄﾙﾌﾞﾗﾝｼｪ1階,26.2150401,127.6753185,,,,,,,,098-864-1093,098-866-8360
コクミン薬局新梅田店,530-0002,大阪府大阪市北区曽根崎新地1堂島地下街1号,34.6962688,135.4942612,,,,,,,,06-6346-0741,06-6346-0741
亀沢薬局,130-0014,東京都墨田区亀沢2-12-2ﾒｿﾞﾝ錦糸町1階,35.697409,139.8015642,,,,,,,,03-3829-1188,03-6658-5562
そうごう薬局京都松尾店,615-8282,京都府京都市西京区松尾大利町11-1,34.9906909,135.6925241,,,,,,,,075-394-2671,075-394-2672
ウエルシア函南間宮店,419-0123,静岡県田方郡函南町間宮618-1,35.0784412,138.9398817,,,,,,,,055-970-1060,055-970-1061
スギ薬局東加賀屋店,559-0012,大阪府大阪市住之江区東加賀屋1-1-23,34.6221743,135.4855679,,,,,,,,06-4702-6035,06-6686-5567
ハジメ薬局綱島東店,223-0052,神奈川県横浜市港北区綱島東2-13-24,35.5368211,139.6369267,,,,,,,,045-546-0890,045-541-2729
V・drug大垣築捨薬局,503-0854,岐阜県大垣市築捨町2-94,35.3387288,136.6226379,,,,,,,,0584-47-5582,0584-47-5583
調剤薬局ツルハドラッグ都立大学店,152-0031,東京都目黒区中根1-3-9,35.6174075,139.6757807,,,,,,,,03-5731-6822,03-5731-6822
コクミンドラッグ兵庫駅店,652-0897,兵庫県神戸市兵庫区駅南通5-3-1　JR兵庫駅NKﾋﾞﾙ1F,34.6679701,135.1649122,,,,,,,,078-579-8802,078-387-5903
日本調剤水戸日赤病院前薬局,310-0011,茨城県水戸市三の丸3-12-50,36.3707516,140.4876439,,,,,,,,029-284-1880,029-284-1881
日本調剤丸太町薬局,602-8031,京都府京都市上京区東裏辻町417　大和ﾋﾞﾙ1F,35.0187165,135.7553403,,,,,,,,075-213-6301,075-213-6327
ヤックスドラッグ浦安東野薬局,279-0042,千葉県浦安市東野3-4-11,35.6469305,139.8936575,,,,,,,,047-712-8017,047-712-8027
